{
  "schema_version": 1,
  "commit_sha": "0000000000000000000000000000000000000000",
  "window_started_at": "2026-09-04T19:00:00Z",
  "window_ended_at": "2026-09-04T20:00:00Z",
  "machine_profile": "macbook-air-apple-m5-24gb",
  "results": [
    {
      "key": "app.zoom",
      "status": "blocked",
      "started_at": "2026-09-04T19:00:00Z",
      "ended_at": "2026-09-04T19:00:01Z",
      "microphone_track_present": false,
      "system_audio_track_present": false,
      "required_tracks_failure": false,
      "gap_count": 0,
      "sealed": false,
      "spool_retained": false,
      "upload_state": "not-started",
      "machine_code": "verification-not-run",
      "artifact_sha256": "3ee2db8da31ceb16afbe5b1d8f1e895c712ba2a2827718707627041cd5feeb8f"
    },
    {
      "key": "app.teams",
      "status": "blocked",
      "started_at": "2026-09-04T19:00:00Z",
      "ended_at": "2026-09-04T19:00:01Z",
      "microphone_track_present": false,
      "system_audio_track_present": false,
      "required_tracks_failure": false,
      "gap_count": 0,
      "sealed": false,
      "spool_retained": false,
      "upload_state": "not-started",
      "machine_code": "verification-not-run",
      "artifact_sha256": "483f3e49252d2c21d0acd0e494dc299383b051e00130be53453b65f870b5932b"
    },
    {
      "key": "app.meet-browser-call",
      "status": "blocked",
      "started_at": "2026-09-04T19:00:00Z",
      "ended_at": "2026-09-04T19:00:01Z",
      "microphone_track_present": false,
      "system_audio_track_present": false,
      "required_tracks_failure": false,
      "gap_count": 0,
      "sealed": false,
      "spool_retained": false,
      "upload_state": "not-started",
      "machine_code": "verification-not-run",
      "artifact_sha256": "27e1fc1695977c6c7e9d84c9b3f329eec42a4d3729a672e1fb5e64d6ceb7ad56"
    },
    {
      "key": "app.tam-forge-tts-interviewer",
      "status": "blocked",
      "started_at": "2026-09-04T19:00:00Z",
      "ended_at": "2026-09-04T19:00:01Z",
      "microphone_track_present": false,
      "system_audio_track_present": false,
      "required_tracks_failure": false,
      "gap_count": 0,
      "sealed": false,
      "spool_retained": false,
      "upload_state": "not-started",
      "machine_code": "verification-not-run",
      "artifact_sha256": "019036a5359662e2ba8dc2bc619bb852d8d2aefbd0c3a4eff7b771e8eb328c48"
    },
    {
      "key": "app.browser-local-playback",
      "status": "blocked",
      "started_at": "2026-09-04T19:00:00Z",
      "ended_at": "2026-09-04T19:00:01Z",
      "microphone_track_present": false,
      "system_audio_track_present": false,
      "required_tracks_failure": false,
      "gap_count": 0,
      "sealed": false,
      "spool_retained": false,
      "upload_state": "not-started",
      "machine_code": "verification-not-run",
      "artifact_sha256": "8cd37bd84f4eefe73de1731357334bd33b6fb58f7fc9065c055ea23b77ebcd61"
    },
    {
      "key": "placement.foreground",
      "status": "blocked",
      "started_at": "2026-09-04T19:00:00Z",
      "ended_at": "2026-09-04T19:00:01Z",
      "microphone_track_present": false,
      "system_audio_track_present": false,
      "required_tracks_failure": false,
      "gap_count": 0,
      "sealed": false,
      "spool_retained": false,
      "upload_state": "not-started",
      "machine_code": "verification-not-run",
      "artifact_sha256": "2b9664bd31bf93e1ccf3fc890fff7bc0b174f11620a6fa672277da8ca43a4557"
    },
    {
      "key": "placement.background",
      "status": "blocked",
      "started_at": "2026-09-04T19:00:00Z",
      "ended_at": "2026-09-04T19:00:01Z",
      "microphone_track_present": false,
      "system_audio_track_present": false,
      "required_tracks_failure": false,
      "gap_count": 0,
      "sealed": false,
      "spool_retained": false,
      "upload_state": "not-started",
      "machine_code": "verification-not-run",
      "artifact_sha256": "27eb8b65fb7fdcb46e052afa5cf09fc9053c8107215a3bb34167e85fd928c9cd"
    },
    {
      "key": "placement.minimized",
      "status": "blocked",
      "started_at": "2026-09-04T19:00:00Z",
      "ended_at": "2026-09-04T19:00:01Z",
      "microphone_track_present": false,
      "system_audio_track_present": false,
      "required_tracks_failure": false,
      "gap_count": 0,
      "sealed": false,
      "spool_retained": false,
      "upload_state": "not-started",
      "machine_code": "verification-not-run",
      "artifact_sha256": "6e7ece054bbe81fdad90cbace667e5d76a65e6b11edfef6c35a93761ab786511"
    },
    {
      "key": "display.internal",
      "status": "blocked",
      "started_at": "2026-09-04T19:00:00Z",
      "ended_at": "2026-09-04T19:00:01Z",
      "microphone_track_present": false,
      "system_audio_track_present": false,
      "required_tracks_failure": false,
      "gap_count": 0,
      "sealed": false,
      "spool_retained": false,
      "upload_state": "not-started",
      "machine_code": "verification-not-run",
      "artifact_sha256": "42f0f9653aa75d08ce65dbd7a6b8a809e509ae102f46c97cd77bb1570ac977f9"
    },
    {
      "key": "display.external",
      "status": "blocked",
      "started_at": "2026-09-04T19:00:00Z",
      "ended_at": "2026-09-04T19:00:01Z",
      "microphone_track_present": false,
      "system_audio_track_present": false,
      "required_tracks_failure": false,
      "gap_count": 0,
      "sealed": false,
      "spool_retained": false,
      "upload_state": "not-started",
      "machine_code": "verification-not-run",
      "artifact_sha256": "9fb9020771a60fc11311dee1981094f03c512353d978eeae1c62ffda3714d72f"
    },
    {
      "key": "output.headphones",
      "status": "blocked",
      "started_at": "2026-09-04T19:00:00Z",
      "ended_at": "2026-09-04T19:00:01Z",
      "microphone_track_present": false,
      "system_audio_track_present": false,
      "required_tracks_failure": false,
      "gap_count": 0,
      "sealed": false,
      "spool_retained": false,
      "upload_state": "not-started",
      "machine_code": "verification-not-run",
      "artifact_sha256": "fb9db939c9140bb5b2f435bfc24dcedf02786bd107c29b773a44fb3b303810c7"
    },
    {
      "key": "output.speakers",
      "status": "blocked",
      "started_at": "2026-09-04T19:00:00Z",
      "ended_at": "2026-09-04T19:00:01Z",
      "microphone_track_present": false,
      "system_audio_track_present": false,
      "required_tracks_failure": false,
      "gap_count": 0,
      "sealed": false,
      "spool_retained": false,
      "upload_state": "not-started",
      "machine_code": "verification-not-run",
      "artifact_sha256": "c2dc35e97873e2dec0ae7c9a507b8edda78d17a2c6d710dfbfe80b3173d0daa1"
    },
    {
      "key": "route.microphone-change",
      "status": "blocked",
      "started_at": "2026-09-04T19:00:00Z",
      "ended_at": "2026-09-04T19:00:01Z",
      "microphone_track_present": false,
      "system_audio_track_present": false,
      "required_tracks_failure": false,
      "gap_count": 0,
      "sealed": false,
      "spool_retained": false,
      "upload_state": "not-started",
      "machine_code": "verification-not-run",
      "artifact_sha256": "6e8e0d9053cb2946acd697705428a8e91e7276243a27ba26b2886f100872cf35"
    },
    {
      "key": "route.output-change",
      "status": "blocked",
      "started_at": "2026-09-04T19:00:00Z",
      "ended_at": "2026-09-04T19:00:01Z",
      "microphone_track_present": false,
      "system_audio_track_present": false,
      "required_tracks_failure": false,
      "gap_count": 0,
      "sealed": false,
      "spool_retained": false,
      "upload_state": "not-started",
      "machine_code": "verification-not-run",
      "artifact_sha256": "c450d02d446b235af46459945aed169656e50fd0e294eb31e06eafb9a7b41a6c"
    },
    {
      "key": "permission.allowed",
      "status": "blocked",
      "started_at": "2026-09-04T19:00:00Z",
      "ended_at": "2026-09-04T19:00:01Z",
      "microphone_track_present": false,
      "system_audio_track_present": false,
      "required_tracks_failure": false,
      "gap_count": 0,
      "sealed": false,
      "spool_retained": false,
      "upload_state": "not-started",
      "machine_code": "verification-not-run",
      "artifact_sha256": "41f75d0b05928f56f933b78a251c6b56cb7353ac2155f77d3884e0904212249a"
    },
    {
      "key": "permission.denied",
      "status": "blocked",
      "started_at": "2026-09-04T19:00:00Z",
      "ended_at": "2026-09-04T19:00:01Z",
      "microphone_track_present": false,
      "system_audio_track_present": false,
      "required_tracks_failure": false,
      "gap_count": 0,
      "sealed": false,
      "spool_retained": false,
      "upload_state": "not-started",
      "machine_code": "verification-not-run",
      "artifact_sha256": "38cc27123a1970c28f46688c75aa73ce7448a35673e3484182cca8ddfe23f9e8"
    },
    {
      "key": "microphone.in-use",
      "status": "blocked",
      "started_at": "2026-09-04T19:00:00Z",
      "ended_at": "2026-09-04T19:00:01Z",
      "microphone_track_present": false,
      "system_audio_track_present": false,
      "required_tracks_failure": false,
      "gap_count": 0,
      "sealed": false,
      "spool_retained": false,
      "upload_state": "not-started",
      "machine_code": "verification-not-run",
      "artifact_sha256": "13f1c8d258411447ac2e38175e8d42ec5afdd5d276fe6189e47486b10573fd99"
    },
    {
      "key": "silence.microphone",
      "status": "blocked",
      "started_at": "2026-09-04T19:00:00Z",
      "ended_at": "2026-09-04T19:00:01Z",
      "microphone_track_present": false,
      "system_audio_track_present": false,
      "required_tracks_failure": false,
      "gap_count": 0,
      "sealed": false,
      "spool_retained": false,
      "upload_state": "not-started",
      "machine_code": "verification-not-run",
      "artifact_sha256": "5680a25ac7c6570279edcba7ec20ff59ba8675335ff21ad5e0d8f7d11dbca7e3"
    },
    {
      "key": "silence.system-audio",
      "status": "blocked",